{
  "$schema": "http://json-schema.org/draft-07/schema#",
  "description": "The metadata for the courses",

  "definitions": {
    "CommentContent": {
      "description": "The content of a comment",
      "anyOf": [{ "type": "object" }, { "type": "string" }, { "type": "array" }]
    },
    "CourseCode": {
      "type": "string",
      "pattern": "^\\S+ \\S+$",
      "description": "The course code"
    },
    "CourseInput": {
      "type": "object",
      "description": "Course metadata",
      "required": ["name"],
      "properties": {
        "name": { "type": "string" },
        "reqs": {
          "type": "array",
          "description": "Course requirements",
          "uniqueItems": true,
          "items": { "$ref": "#/definitions/CourseCode" }
        },
        "coreqs": {
          "type": "array",
          "description": "Course co-requirements",
          "uniqueItems": true,
          "items": { "$ref": "#/definitions/CourseCode" }
        }
      }
    },
    "CourseInputOrName": {
      "anyOf": [
        { "$ref": "#/definitions/CourseInput" },
        { "type": "string", "description": "The course name" }
      ]
    },
    "CourseInputFT": {
      "allOf": [
        {
          "required": ["replaces"],
          "properties": {
            "replaces": {
              "anyOf": [
                { "$ref": "#/definitions/CourseCode" },
                { "type": "null" }
              ]
            }
          }
        },
        { "$ref": "#/definitions/CourseInput" }
      ]
    },
    "SemesterCourseMapInput": {
      "type": "object",
      "description": "Courses per semester (YYYY Semester, e.g. 2018 Fall)",
      "additionalProperties": false,
      "properties": {
        "Transfer": {
          "type": "array",
          "description": "Courses transferred from other schools",
          "items": { "$ref": "#/definitions/CourseCode" }
        }
      },
      "patternProperties": {
        "^//.*": { "$ref": "#/definitions/CommentContent" },
        "^\\d{4} (Fall|Spring|Summer)$": {
          "type": "array",
          "description": "Courses taken in semester",
          "items": { "$ref": "#/definitions/CourseCode" }
        }
      }
    }
  },

  "type": "object",
  "required": ["courses", "taken", "degree"],
  "additionalProperties": false,
  "properties": {
    "$schema": {
      "type": "string",
      "description": "The JSON schema being used"
    },
    "degree": {
      "type": "string",
      "description": "The name of the degree being studied"
    },
    "courses": {
      "type": "object",
      "description": "Courses required for the degree",
      "patternProperties": {
        "^//.*": { "$ref": "#/definitions/CommentContent" },
        "\\S+ \\S+": { "$ref": "#/definitions/CourseInputOrName" }
      }
    },
    "Fast Track": {
      "type": "object",
      "description": "Courses taking for fast track program",
      "patternProperties": {
        "^//.*": { "$ref": "#/definitions/CommentContent" },
        "\\S+ \\S+": { "$ref": "#/definitions/CourseInputFT" }
      }
    },
    "taken": { "$ref": "#/definitions/SemesterCourseMapInput" },
    "future": { "$ref": "#/definitions/SemesterCourseMapInput" }
  }
}
